{"$schema":"https://json-schema.org/draft/2020-12/schema","additionalProperties":false,"properties":{"acceptableSecondaryAreas":{"items":{"enum":["Agro y Producción Agropecuaria","Algoritmos y Estructuras de Datos","Ambiente y Sostenibilidad","Antenas, Propagación y Microondas","Arquitectura de Aplicaciones","Arquitectura y Organización de Computadores","Automatización y Control Industrial","Bases de Datos","Bioética y Bioseguridad","Bioinformática","Biotecnología","Bromatología y Nutrición","Ciberseguridad","Ciencia de Materiales","Cloud Computing","Comunicación y Humanidades","Costos y Contabilidad","Datos","Derecho Informático","Derecho y Regulación","Desarrollo de Aplicaciones Móviles","Diseño y Desarrollo de Videojuegos","Electrónica","Electrónica y Dispositivos","Electrotecnia y Circuitos Eléctricos","Estadística","Física","Fisicoquímica y Química Analítica","Genómica y Proteómica","Gestión de Operaciones y Calidad Industrial","Gestión de Proyectos Tecnológicos","Gestión Económica Industrial","Hidráulica y Neumática","Ingeniería de Datos","Ingeniería de Software","Ingeniería Eléctrica y Potencia","Ingeniería Industrial y Gestión de Costos","Innovación Tecnológica","Instrumentación y Mediciones","Inteligencia Artificial","Investigación Operativa y Optimización","Logística y Cadena de Abastecimiento","Machine Learning","Manufactura y CAD/CAM","Máquinas Eléctricas y Conversión Electromecánica","Matemática","Mecánica de Fluidos y Termofluidos","Métodos Numéricos y Cálculo Científico","Microbiología","Modelado, Simulación y Sistemas Dinámicos","Procesos de Alimentos y Bebidas","Química","Química Orgánica y Biológica","Recursos Hídricos y Gestión Ambiental","Redes de Computadoras y Servicios de Red","Redes de Datos","Redes y Comunicaciones","Resistencia de Materiales y Mecánica del Sólido","Robótica y Sistemas Autónomos","Seguridad Industrial e Higiene","Señales y Sistemas","Sistemas de Información y Negocio","Sistemas de Representación y Dibujo Técnico","Sistemas Digitales y Hardware","Tecnología de Alimentos","Tecnología Industrial de los Alimentos","Telecomunicaciones","Telecomunicaciones de Datos","Termodinámica y Transferencia de Calor"],"type":"string"},"type":"array","uniqueItems":true},"annotationConfidence":{"enum":["HIGH","MEDIUM","LOW"],"type":"string"},"annotationStatus":{"enum":["CLEAR","BOUNDARY","MULTIDISCIPLINARY","NO_FIT"],"type":"string"},"caseId":{"type":"string"},"primaryArea":{"oneOf":[{"enum":["Agro y Producción Agropecuaria","Algoritmos y Estructuras de Datos","Ambiente y Sostenibilidad","Antenas, Propagación y Microondas","Arquitectura de Aplicaciones","Arquitectura y Organización de Computadores","Automatización y Control Industrial","Bases de Datos","Bioética y Bioseguridad","Bioinformática","Biotecnología","Bromatología y Nutrición","Ciberseguridad","Ciencia de Materiales","Cloud Computing","Comunicación y Humanidades","Costos y Contabilidad","Datos","Derecho Informático","Derecho y Regulación","Desarrollo de Aplicaciones Móviles","Diseño y Desarrollo de Videojuegos","Electrónica","Electrónica y Dispositivos","Electrotecnia y Circuitos Eléctricos","Estadística","Física","Fisicoquímica y Química Analítica","Genómica y Proteómica","Gestión de Operaciones y Calidad Industrial","Gestión de Proyectos Tecnológicos","Gestión Económica Industrial","Hidráulica y Neumática","Ingeniería de Datos","Ingeniería de Software","Ingeniería Eléctrica y Potencia","Ingeniería Industrial y Gestión de Costos","Innovación Tecnológica","Instrumentación y Mediciones","Inteligencia Artificial","Investigación Operativa y Optimización","Logística y Cadena de Abastecimiento","Machine Learning","Manufactura y CAD/CAM","Máquinas Eléctricas y Conversión Electromecánica","Matemática","Mecánica de Fluidos y Termofluidos","Métodos Numéricos y Cálculo Científico","Microbiología","Modelado, Simulación y Sistemas Dinámicos","Procesos de Alimentos y Bebidas","Química","Química Orgánica y Biológica","Recursos Hídricos y Gestión Ambiental","Redes de Computadoras y Servicios de Red","Redes de Datos","Redes y Comunicaciones","Resistencia de Materiales y Mecánica del Sólido","Robótica y Sistemas Autónomos","Seguridad Industrial e Higiene","Señales y Sistemas","Sistemas de Información y Negocio","Sistemas de Representación y Dibujo Técnico","Sistemas Digitales y Hardware","Tecnología de Alimentos","Tecnología Industrial de los Alimentos","Telecomunicaciones","Telecomunicaciones de Datos","Termodinámica y Transferencia de Calor"],"type":"string"},{"const":"NONE"}]},"rationale":{"type":"string"},"supportingFragments":{"items":{"type":"string"},"type":"array"}},"required":["caseId","primaryArea","acceptableSecondaryAreas","annotationStatus","annotationConfidence","rationale","supportingFragments"],"title":"area_embedding_human_annotation_response_v1","type":"object"}