[{"acceptableSecondaryAreas":["Bromatología y Nutrición","Tecnología de Alimentos"],"annotationConfidence":"HIGH","annotationStatus":"MULTIDISCIPLINARY","caseId":"scope-area-eval-v1-073","primaryArea":"Microbiología","rationale":"Estudio de microorganismos patógenos e indicadores en productos alimenticios.","supportingFragments":["Adquirir la capacidad teórica requerida para efectuar interpretaciones de la Seguridad Alimentaria","Unidad 1: ALTERACIÓN DE LOS ALIMENTOS\nParámetros extrínsecos:"]},{"acceptableSecondaryAreas":["Procesos de Alimentos y Bebidas","Tecnología de Alimentos"],"annotationConfidence":"HIGH","annotationStatus":"BOUNDARY","caseId":"scope-area-eval-v1-067","primaryArea":"Tecnología Industrial de los Alimentos","rationale":"Industrialización de cereales, oleaginosas y materias primas agrícolas.","supportingFragments":["Diseñar procesos tecnológicos para la producción de alimentos partiendo de materias primas primarias","MATERIAS PRIMAS Y PRODUCTOS PRIMARIOS Materias primas."]},{"acceptableSecondaryAreas":["Ingeniería Industrial y Gestión de Costos","Gestión Económica Industrial"],"annotationConfidence":"HIGH","annotationStatus":"MULTIDISCIPLINARY","caseId":"scope-area-eval-v1-054","primaryArea":"Costos y Contabilidad","rationale":"Integra contabilidad general y sistemas de costos industriales.","supportingFragments":["Desarrollar conocimientos básicos la Contabilidad General y de cálculo de los costos industriales","La contabilidad como herramienta para la gestión:"]},{"acceptableSecondaryAreas":["Ingeniería de Datos"],"annotationConfidence":"HIGH","annotationStatus":"CLEAR","caseId":"scope-area-eval-v1-006","primaryArea":"Bases de Datos","rationale":"Diseño relacional, SQL, índices y normalización de datos.","supportingFragments":["Reforzar el conocimiento del funcionamiento de las unidades de almacenamiento","Evolución desde los sistemas de archivo."]},{"acceptableSecondaryAreas":["Manufactura y CAD/CAM"],"annotationConfidence":"MEDIUM","annotationStatus":"MULTIDISCIPLINARY","caseId":"scope-area-eval-v1-051","primaryArea":"Instrumentación y Mediciones","rationale":"Metrología, verificación dimensional y herramientas de mecanizado.","supportingFragments":["Conocer y entender la problemática de la macro y micro forma de una pieza","Mediciones. Ajustes y Tolerancias."]},{"acceptableSecondaryAreas":["Redes de Datos","Telecomunicaciones","Antenas, Propagación y Microondas"],"annotationConfidence":"MEDIUM","annotationStatus":"BOUNDARY","caseId":"scope-area-eval-v1-035","primaryArea":"Telecomunicaciones de Datos","rationale":"Sistemas de conmutación, señalización y enlaces de comunicaciones.","supportingFragments":["• Comprender la evolución histórico-tecnológicade los sistemas de comunicaciones de voz y datos.","Enlaces radiales de ondas largas y ondas cortas. Enlaces en muy alta frecuencia (VHF) y ultra alta frecuencia (UHF)."]},{"acceptableSecondaryAreas":["Datos"],"annotationConfidence":"HIGH","annotationStatus":"CLEAR","caseId":"scope-area-eval-v1-112","primaryArea":"Estadística","rationale":"Estadística descriptiva e inferencial básica.","supportingFragments":["Comprender situaciones o fenómenos reales que se producen en condiciones de incertidumbre","ANÁLISIS DESCRIPTIVO DE DATOS\nFenómeno aleatorio. Variable aleatoria. Población."]},{"acceptableSecondaryAreas":["Bioinformática"],"annotationConfidence":"HIGH","annotationStatus":"CLEAR","caseId":"scope-area-eval-v1-079","primaryArea":"Genómica y Proteómica","rationale":"Análisis de genomas, transcriptómica y proteómica.","supportingFragments":["Conocer y comprender los aspectos conceptuales relacionados con la genómica y la proteómica","INTRODUCCIÓN A LA GENÓMICA Y SUS APLICACIONES Concepto de Genoma."]},{"acceptableSecondaryAreas":["Ingeniería Industrial y Gestión de Costos"],"annotationConfidence":"HIGH","annotationStatus":"CLEAR","caseId":"scope-area-eval-v1-056","primaryArea":"Gestión de Operaciones y Calidad Industrial","rationale":"Estudio de métodos, tiempos, ergonomía y productividad.","supportingFragments":["• Aplicar los métodos y técnicas que les permitan contribuir al aumento de productividad de las empresas en las que se\ndesempeñaran como futuros profesionales.","Estudio de métodos, ergonomía y medición del trabajo."]},{"acceptableSecondaryAreas":["Cloud Computing","Arquitectura y Organización de Computadores","Ciberseguridad"],"annotationConfidence":"HIGH","annotationStatus":"MULTIDISCIPLINARY","caseId":"scope-area-eval-v1-081","primaryArea":"Redes y Comunicaciones","rationale":"Computación paralela, distribuida y programación en clusters/red.","supportingFragments":["Conocimientos sobre sistemas de memoria compartida; sistemas distribuidos;","Conceptos de redes de alta disponibilidad: arquitecturas, protocolos. Sockets. Computación paralela, distribuida y Grid."]},{"acceptableSecondaryAreas":["Electrotecnia y Circuitos Eléctricos","Electrónica y Dispositivos","Sistemas Digitales y Hardware"],"annotationConfidence":"HIGH","annotationStatus":"CLEAR","caseId":"scope-area-eval-v1-040","primaryArea":"Electrónica","rationale":"Circuitos analógicos, semiconductores y amplificadores.","supportingFragments":["Comprender, analizar y relacionar los distintos componentes de los circuitos que emplean dispositivos electrónicos.","Resolución de circuitos de corriente continua por:"]},{"acceptableSecondaryAreas":["Costos y Contabilidad"],"annotationConfidence":"HIGH","annotationStatus":"BOUNDARY","caseId":"scope-area-eval-v1-055","primaryArea":"Gestión Económica Industrial","rationale":"Análisis financiero y evaluación económica de proyectos de inversión.","supportingFragments":["• Comprender el concepto del valor del dinero en el tiempo.","Decisiones de inversión y de\nfinanciación."]},{"acceptableSecondaryAreas":["Ingeniería de Software","Arquitectura de Aplicaciones","Bases de Datos"],"annotationConfidence":"HIGH","annotationStatus":"CLEAR","caseId":"scope-area-eval-v1-011","primaryArea":"Desarrollo de Aplicaciones Móviles","rationale":"Desarrollo de aplicaciones móviles con frameworks específicos.","supportingFragments":["Construir aplicaciones móviles utilizando frameworks de desarrollo específicos","Diseño de aplicaciones para dispositivos móviles."]},{"acceptableSecondaryAreas":["Sistemas Digitales y Hardware"],"annotationConfidence":"HIGH","annotationStatus":"BOUNDARY","caseId":"scope-area-eval-v1-015","primaryArea":"Arquitectura y Organización de Computadores","rationale":"Organización interna del procesador, memorias y controladores.","supportingFragments":["Comprender la tecnología básica usada en las computadoras","Organización de un computador y su funcionamiento interno."]},{"acceptableSecondaryAreas":["Ciencia de Materiales","Procesos de Alimentos y Bebidas","Gestión de Operaciones y Calidad Industrial"],"annotationConfidence":"HIGH","annotationStatus":"MULTIDISCIPLINARY","caseId":"scope-area-eval-v1-071","primaryArea":"Tecnología de Alimentos","rationale":"Propiedades de materiales de empaque e inocuidad de envases.","supportingFragments":["Conocer los materiales y procedimientos de envase de productos alimenticios","INTRODUCCIÓN A ENVASES Y EMBALAJES, SU IMPORTANCIA EN TECNOLOGÍA DE\nALIMENTOS."]},{"acceptableSecondaryAreas":["Diseño y Desarrollo de Videojuegos"],"annotationConfidence":"HIGH","annotationStatus":"MULTIDISCIPLINARY","caseId":"scope-area-eval-v1-110","primaryArea":"Física","rationale":"Leyes de la física clásica aplicadas al desarrollo de juegos.","supportingFragments":["Observar, medir y comprender fenómenos físicos sencillos","Nociones de física aplicadas al desarrollo de videojuegos."]},{"acceptableSecondaryAreas":["Redes de Datos"],"annotationConfidence":"HIGH","annotationStatus":"MULTIDISCIPLINARY","caseId":"scope-area-eval-v1-034","primaryArea":"Ciberseguridad","rationale":"Criptografía y controles de ciberseguridad en redes de datos.","supportingFragments":["Identificar las amenazas y vulnerabilidades de un sistema de comunicaciones","Evaluación de riesgos y contramedidas. Modelo de seguridad en redes."]},{"acceptableSecondaryAreas":["Antenas, Propagación y Microondas"],"annotationConfidence":"HIGH","annotationStatus":"MULTIDISCIPLINARY","caseId":"scope-area-eval-v1-031","primaryArea":"Telecomunicaciones","rationale":"Enlaces por satélite, propagación y estaciones terrenas.","supportingFragments":["Comprender los fundamentos de las comunicaciones entre estaciones espaciales y terrenas","Aprendizaje del cálculo de períodos orbitales,sectores de cobertura y arcos de visibilidad."]},{"acceptableSecondaryAreas":["Sistemas Digitales y Hardware"],"annotationConfidence":"HIGH","annotationStatus":"CLEAR","caseId":"scope-area-eval-v1-005","primaryArea":"Arquitectura y Organización de Computadores","rationale":"Microarquitectura de procesadores, buses, jerarquía de memoria y ensamblador.","supportingFragments":["Comprender la tecnología básica usada en las computadoras y las tendencias actuales","Introducción a la Arquitectura de Computadores"]},{"acceptableSecondaryAreas":["Redes de Datos","Señales y Sistemas"],"annotationConfidence":"HIGH","annotationStatus":"MULTIDISCIPLINARY","caseId":"scope-area-eval-v1-030","primaryArea":"Telecomunicaciones","rationale":"Teoría de la información, canales de comunicación y espectro.","supportingFragments":["Incorporar los principios teóricos de la información y de las telecomunicaciones","Modelos de la Teoría de la Información. Conceptos básicos de los Sistemas de Comunicaciones y de Teleinformática."]},{"acceptableSecondaryAreas":["Fisicoquímica y Química Analítica","Derecho y Regulación"],"annotationConfidence":"HIGH","annotationStatus":"CLEAR","caseId":"scope-area-eval-v1-075","primaryArea":"Bromatología y Nutrición","rationale":"Análisis bromatológico y composición químico-física de los alimentos.","supportingFragments":["Reconocer la composición fisicoquímica de un producto alimenticio","ANÁLISIS DE LOS ALIMENTOS\nFundamento Interrelación con otras disciplinas. Contamin